{
  "allowed_rollout_modes": [
    "off",
    "extraction_only",
    "shadow_retrieval",
    "shadow_tooling",
    "paper_trading",
    "limited_production",
    "production"
  ],
  "flags": {
    "analytical_footprint_enabled": true,
    "method_pattern_registry_enabled": true,
    "production_use_of_weighted_reports": false,
    "report_weighting_enabled": true,
    "shadow_tool_runtime_enabled": true,
    "tool_design_loop_enabled": true,
    "weighted_research_retriever_enabled": true
  },
  "rollout_mode": "shadow_tooling",
  "runtime_behavior": "shadow retrieval and shadow tooling only; no agent decision impact; no trade without current data confirmation, validated recipes, paper trading gates, and production promotion approval"
}
